{
  "_schema": "ruptura.vtt.content.acoes_combate.v1.1",
  "_meta": {
    "conteudo": "acoes_combate",
    "fonte": "16 COMBATE 0210a136355282b09ba50128db510387.md",
    "hash_sha256_origem": "462f093c61a7c623fb8fcd16180515825ba04d57afb8f4f1a2e2dece0d90596b",
    "versao_schema": "1.1.0",
    "status_padrao": "published",
    "gerado_em": "2026-06-25",
    "total_registros": 30,
    "observacoes": [
      "Catálogo de ações extraído do capítulo de Combate.",
      "Ações defensivas são tipo reacao.",
      "Aparar, Bloquear e Resistir são ações; quando referenciadas por talentos, devem usar alvo_acoes.",
      "Visibilidade condicional controla exibição por condição, não valida alvo ou token.",
      "Fonte autoritativa do catálogo de ações (M5). Integridade referencial profunda validada por validação semântica customizada."
    ],
    "revisao": "v1.1: schema estrito (additionalProperties=false, enums de FK), efeitos_combate declarado, fonte autoritativa de M5."
  },
  "enums": {
    "status": [
      "draft",
      "published",
      "archived"
    ],
    "categoria": [
      "movimento",
      "ofensiva",
      "defensiva",
      "diversa",
      "livre"
    ],
    "tipo": [
      "acao",
      "reacao",
      "acao_livre",
      "acao_reacao"
    ],
    "pericias": [
      "arcanismo",
      "artes",
      "balistica",
      "biologia",
      "carisma",
      "engenharia",
      "furtividade",
      "influencia",
      "intimidacao",
      "logica",
      "luta",
      "mobilidade",
      "percepcao",
      "precisao",
      "psicologia",
      "reflexos",
      "robotica",
      "sociedade",
      "tecnomagia",
      "vigor",
      "vontade"
    ],
    "condicoes": [
      "agarrado",
      "agarrando",
      "atordoado",
      "caido",
      "cego",
      "contundido",
      "envenenado",
      "imobilizado",
      "inconsciente",
      "insaturado",
      "lento",
      "ofuscado",
      "queimando",
      "sangrando",
      "saturado",
      "sufocando",
      "surdo",
      "oculto"
    ],
    "acoes": [
      "deslocar",
      "levantar",
      "escapar",
      "fintar",
      "interagir",
      "sacar_rapido",
      "sacar_dificil",
      "recarregar",
      "postura_ofensiva",
      "atacar",
      "agarrar",
      "estrangular",
      "derrubar",
      "empurrar",
      "desarmar",
      "postura_defensiva",
      "aparar",
      "bloquear",
      "esquivar",
      "resistir",
      "mirar",
      "acessar_trama",
      "preparar_turno",
      "usar_pericia",
      "falar",
      "gestos_rapidos",
      "soltar_alvo",
      "apagar_fogo",
      "esconder_se",
      "ataque_secundario"
    ],
    "tags_rolagem": [
      "acao",
      "ofensiva",
      "defensiva",
      "movimento",
      "visao",
      "audicao",
      "sentido",
      "corpo",
      "ataque_corpo_a_corpo",
      "ataque_distancia",
      "ataque_direcional",
      "ataque_area",
      "conjuracao",
      "magia",
      "reacao",
      "cobertura",
      "terreno",
      "social",
      "trama",
      "malha",
      "arcanismo",
      "artes",
      "balistica",
      "biologia",
      "carisma",
      "engenharia",
      "furtividade",
      "influencia",
      "intimidacao",
      "logica",
      "luta",
      "mobilidade",
      "percepcao",
      "precisao",
      "psicologia",
      "reflexos",
      "robotica",
      "sociedade",
      "tecnomagia",
      "vigor",
      "vontade"
    ],
    "efeitos_combate": [
      "acao_livre",
      "acao_pericia_aberta",
      "acumular_bonus_mirar",
      "aplicar_condicao",
      "aplicar_condicao_em_si",
      "aplicar_penalidade",
      "aplicar_postura",
      "bloquear_alvejamento",
      "causar_dano",
      "composto",
      "conceder_cobertura",
      "consequencia_narrador",
      "controle_corpo_a_corpo",
      "criar_abertura",
      "criar_preparacao_turno",
      "dano_extra_proximo_ataque",
      "defesa_ativa",
      "desarmar",
      "desarmar_alvo",
      "efeito_tatico_narrativo",
      "empurrar",
      "estrangular_alvo",
      "executar_protocolo_malha",
      "falha_automatica",
      "forcar_gasto_pa_defesa",
      "forcar_teste_simples",
      "habilitar_deslocamento_em_partes",
      "habilitar_teste_escapar_imediato",
      "ignorar_terreno_dificil",
      "incrementar_custo_por_repeticao_no_turno",
      "limitar_alcance_visual",
      "limitar_deslocamento",
      "modificador",
      "modificador_para_escapar",
      "modificador_recebido",
      "modificar_dano",
      "movimento_forcado",
      "multiplicar_altura",
      "multiplicar_custo_deslocamento",
      "multiplicar_deslocamento",
      "multiplicar_distancia",
      "opcional_narrador",
      "opcoes_interacao",
      "recarregar_arma",
      "remover_condicao",
      "remover_condicao_do_oponente",
      "remover_condicoes",
      "remover_restricao_movimento",
      "reposicionar",
      "resolver_acao",
      "resolver_ataque",
      "resolver_ataque_secundario",
      "sacar_ou_guardar",
      "substituir_bonus",
      "teste_esconder_se"
    ],
    "custo_tipos": [
      "pa",
      "reacao",
      "livre",
      "composto"
    ],
    "teste_tipos": [
      "contestado",
      "simples",
      "contestado_ou_cd",
      "contestado_ou_simples",
      "simples_ou_contestado",
      "simples_condicional",
      "opcional_narrador",
      "nenhum"
    ],
    "requisito_tipos": [
      "alcance",
      "mao_livre",
      "alvo_com_condicao_qualquer",
      "arma_com_propriedade",
      "protecao_empunhada",
      "gatilho_unico_e_claro",
      "reacao_disponivel_na_ativacao"
    ]
  },
  "acoes": [
    {
      "id": "deslocar",
      "slug": "deslocar",
      "nome": "Deslocar-se",
      "categoria": "movimento",
      "tipo": "acao",
      "custo": {
        "tipo": "pa",
        "valor": 1,
        "repeticao_mesmo_turno_incremento": 1
      },
      "janela": "rapida_ou_lenta_conforme_total_pa_gasto",
      "visibilidade": "sempre",
      "tags": [
        "movimento"
      ],
      "descricao_curta": "Move o personagem por andar, correr, manobrar ou saltar.",
      "descricao_longa": "Gasta 1 PA para mover-se. Pode repetir no mesmo turno com +1 PA por repetição. O deslocamento de uma mesma ação pode ser dividido ao longo do turno.",
      "payload_automacao": {
        "efeitos": [
          {
            "tipo": "habilitar_deslocamento_em_partes"
          },
          {
            "tipo": "incrementar_custo_por_repeticao_no_turno",
            "incremento_pa": 1
          }
        ]
      },
      "status": "published",
      "versao": "1.0.0",
      "created_at": "2026-06-25",
      "updated_at": "2026-06-25",
      "variantes": [
        {
          "id": "andar",
          "distancia_formula": {
            "op": "+",
            "args": [
              {
                "const": 10
              },
              {
                "ref": "atributo",
                "id": "corpo"
              }
            ]
          },
          "formula_label": "10 + Corpo metros",
          "teste": null
        },
        {
          "id": "correr",
          "distancia_formula": {
            "op": "*",
            "args": [
              {
                "ref": "derivado",
                "id": "andar_m"
              },
              {
                "const": 2
              }
            ]
          },
          "formula_label": "Andar × 2",
          "teste": {
            "tipo": "simples_condicional",
            "pericias": [
              "mobilidade"
            ],
            "dispensa_teste_se_corpo_min": 3
          },
          "falha": [
            {
              "tipo": "limitar_deslocamento",
              "valor_m": 10
            },
            {
              "tipo": "consequencia_narrador",
              "sugestoes": [
                "caido"
              ]
            }
          ]
        },
        {
          "id": "manobrar",
          "distancia_formula": {
            "op": "+",
            "args": [
              {
                "const": 10
              },
              {
                "ref": "atributo",
                "id": "corpo"
              }
            ]
          },
          "formula_label": "10 + Corpo metros",
          "teste": {
            "tipo": "simples",
            "pericias": [
              "mobilidade"
            ]
          },
          "sucesso": [
            {
              "tipo": "ignorar_terreno_dificil"
            },
            {
              "tipo": "efeito_tatico_narrativo"
            }
          ],
          "falha": [
            {
              "tipo": "multiplicar_deslocamento",
              "multiplicador": 0.5,
              "arredondamento": "baixo"
            },
            {
              "tipo": "consequencia_narrador",
              "sugestoes": [
                "caido",
                "lento",
                "complicacao_leve"
              ]
            }
          ]
        },
        {
          "id": "saltar_horizontal",
          "usa_tabela_movimento": "salto_horizontal",
          "impulso": {
            "deslocamento_previo_m": 2,
            "sem_impulso_multiplicador": 0.5
          },
          "extra_se_corpo_min": {
            "corpo_min": 3,
            "teste": {
              "pericias": [
                "mobilidade"
              ]
            },
            "sucesso": {
              "aumentar_distancia_m": 1
            },
            "falha": [
              {
                "tipo": "multiplicar_distancia",
                "multiplicador": 0.5
              },
              {
                "tipo": "aplicar_condicao",
                "condicao": "caido"
              }
            ]
          }
        },
        {
          "id": "saltar_vertical",
          "usa_tabela_movimento": "salto_vertical",
          "extra_se_corpo_min": {
            "corpo_min": 3,
            "teste": {
              "pericias": [
                "mobilidade"
              ]
            },